"","text","favorited","favoriteCount","replyToSN","created","truncated","replyToSID","id","replyToUID","statusSource","screenName","retweetCount","isRetweet","retweeted","longitude","latitude"
"181","@kglbltz between getting a Klose Jersey or a Schweinsteiger jersey thoughts?",FALSE,0,"kglbltz",2014-07-13 16:30:05,FALSE,"488358761472720897","488359722236391426","55277120","<a href=""http://twitter.com"" rel=""nofollow"">Twitter Web Client</a>","sebphins",0,FALSE,FALSE,NA,NA
"182","Today is Ozil, Klose jersey is back home. #Ger will take the cup back to Deutschland. I promise u. 4 star #WorldCup http://t.co/gYDg0Amm59",FALSE,1,NA,2014-07-13 16:24:57,FALSE,NA,"488358430990532608",NA,"<a href=""http://twitter.com/download/android"" rel=""nofollow"">Twitter for Android</a>","isaac976",0,FALSE,FALSE,NA,NA
"183","Spotted: Klose's World Cup 2006 jersey Ì†ΩÌ∏≠",FALSE,2,NA,2014-07-13 16:10:14,FALSE,NA,"488354724492898305",NA,"<a href=""http://twitter.com/download/iphone"" rel=""nofollow"">Twitter for iPhone</a>","zwischenfischen",0,FALSE,FALSE,NA,NA
"184","RT @aylinshakeit: Let's go Germany!We deserve our 4th star on the jersey!Ì†ºÌ∑©Ì†ºÌ∑™‚ù§Ô∏èÌ†ºÌºü#ProudtobeGerman #aneurerseite #GERARG #Brazil2014 #Klose htt‚Ä¶",FALSE,0,NA,2014-07-13 16:07:23,FALSE,NA,"488354007501766656",NA,"<a href=""http://twitter.com/download/android"" rel=""nofollow"">Twitter for Android</a>","YasminSchffer",1,TRUE,FALSE,NA,NA
"185","Let's go Germany!We deserve our 4th star on the jersey!Ì†ºÌ∑©Ì†ºÌ∑™‚ù§Ô∏èÌ†ºÌºü#ProudtobeGerman #aneurerseite #GERARG #Brazil2014 #Klose http://t.co/4U1MnDCyYi",FALSE,2,NA,2014-07-13 16:04:31,FALSE,NA,"488353289227231232",NA,"<a href=""http://twitter.com/download/iphone"" rel=""nofollow"">Twitter for iPhone</a>","aylinshakeit",1,FALSE,FALSE,NA,NA
"186","@THerlz love that jersey. Its a long sleeve tho. Went with the World Cup legend instead, aka Klose",FALSE,1,"THerlz",2014-07-13 15:23:56,FALSE,"488342507881635840","488343073945300992","88546176","<a href=""http://twitter.com/download/iphone"" rel=""nofollow"">Twitter for iPhone</a>","TyDroste13",0,FALSE,FALSE,NA,NA
"187","Betting for the game.
ARG wins: Celebrate downtown with friends :D
GER win: I need to buy a Klose jersey... -_-",FALSE,0,NA,2014-07-13 14:46:58,FALSE,NA,"488333771087704064",NA,"<a href=""http://twitter.com"" rel=""nofollow"">Twitter Web Client</a>","Luminite_Shadow",0,FALSE,FALSE,NA,NA
"188","i need to find my old Klose jersey again idc if it is too small",FALSE,0,NA,2014-07-13 14:25:21,FALSE,NA,"488328330446635009",NA,"<a href=""http://twitter.com/download/iphone"" rel=""nofollow"">Twitter for iPhone</a>","roversderby",0,FALSE,FALSE,NA,NA
"189","Definitely wearing my Klose jersey to church today #GER #DerMannschaft #WorldCup2014",FALSE,1,NA,2014-07-13 14:12:51,FALSE,NA,"488325186253762560",NA,"<a href=""http://twitter.com/download/android"" rel=""nofollow"">Twitter for Android</a>","MLGViking",0,FALSE,FALSE,NA,NA
"190","@JawdathJ: #KLOSE #GERMANY #HOME #AWAY 2014 #WORLDCUP #JERSEY T-SHIRT BRAZIL #SOCCER #FOOTBALL IN #EBAY http://t.co/5l9nU6x1ep",FALSE,0,"JawdathJ",2014-07-13 11:45:53,FALSE,NA,"488288200901681153","2431921496","<a href=""http://twitter.com/download/iphone"" rel=""nofollow"">Twitter for iPhone</a>","JawdathJ",0,FALSE,FALSE,NA,NA
"191","Looking forward to witnessing history tomorrow at the #WorldCup. Love to see #DieMannschaft win it all while I'm sporting my #Klose jersey.",FALSE,0,NA,2014-07-13 06:03:44,FALSE,NA,"488202096693346304",NA,"<a href=""http://twitter.com"" rel=""nofollow"">Twitter Web Client</a>","JoshSaggau",0,FALSE,FALSE,NA,NA
"192","At the age of 10 I received my first ever football jersey from my uncle. It was a #GER Klose jersey. Tomorrow I will see him become champ!",FALSE,1,NA,2014-07-13 04:04:43,FALSE,NA,"488172145647054849",NA,"<a href=""http://twitter.com/download/iphone"" rel=""nofollow"">Twitter for iPhone</a>","MiaSanBayernUSA",0,FALSE,FALSE,NA,NA
"193","Buying a Klose jersey",FALSE,2,NA,2014-07-13 02:43:29,FALSE,NA,"488151701266784259",NA,"<a href=""http://twitter.com/download/iphone"" rel=""nofollow"">Twitter for iPhone</a>","JackKimman",0,FALSE,FALSE,NA,NA
"194","I just bought a signed Klose jersey for $380 #ihaveaproblem #germany Ì†ºÌ∑©Ì†ºÌ∑™Ì†ºÌ∑©Ì†ºÌ∑™Ì†ºÌ∑©Ì†ºÌ∑™ #collectibles",FALSE,0,NA,2014-07-13 00:40:31,FALSE,NA,"488120753083408384",NA,"<a href=""http://twitter.com/download/iphone"" rel=""nofollow"">Twitter for iPhone</a>","_KTam",0,FALSE,FALSE,NA,NA
"195","Just ordered my Klose jersey :) http://t.co/Nn0izjVwt9",FALSE,0,NA,2014-07-12 21:33:37,FALSE,NA,"488073719302995968",NA,"<a href=""http://twitter.com/download/android"" rel=""nofollow"">Twitter for Android</a>","xFelipelicious",0,FALSE,FALSE,NA,NA
"196","Now do I get the home or away klose jersey... Decisions. Decisions...",FALSE,1,NA,2014-07-15 23:54:16,FALSE,NA,"489196281361756160",NA,"<a href=""http://twitter.com/download/iphone"" rel=""nofollow"">Twitter for iPhone</a>","tyler_schwarz",0,FALSE,FALSE,NA,NA
"197","My mom is getting me a Klose jersey for my birthday Ì†ΩÌπå yay",FALSE,1,NA,2014-07-15 23:33:18,FALSE,NA,"489191004717604865",NA,"<a href=""http://twitter.com/download/iphone"" rel=""nofollow"">Twitter for iPhone</a>","barcenas_anna",0,FALSE,FALSE,NA,NA
"198","I told my mom that im thinking about buying a Klose jersey and she said ""do you think he is attractive"" Incredible",FALSE,1,NA,2014-07-15 16:57:14,FALSE,NA,"489091329247678464",NA,"<a href=""http://twitter.com/download/android"" rel=""nofollow"">Twitter for Android</a>","stormsland",0,FALSE,FALSE,NA,NA
"199","gonna order my dad his klose jersey",FALSE,1,NA,2014-07-15 16:00:52,FALSE,NA,"489077142743822337",NA,"<a href=""http://twitter.com/download/iphone"" rel=""nofollow"">Twitter for iPhone</a>","Ozone_yessurr",0,FALSE,FALSE,NA,NA
"200","MY DAD IS BUYING ME A KLOSE JERSEY",FALSE,0,NA,2014-07-15 15:14:06,FALSE,NA,"489065373774278656",NA,"<a href=""http://twitter.com"" rel=""nofollow"">Twitter Web Client</a>","evilmutants",0,FALSE,FALSE,NA,NA
"201","Someone help me decide who's jersey to get while I'm here!Ì†ΩÌ∏©#7 #8 #11 #helpme #Schweinsteiger #√∂zil #klose http://t.co/mDmO6guNY5",FALSE,0,NA,2014-07-15 13:31:01,FALSE,NA,"489039434802024449",NA,"<a href=""http://twitter.com/download/iphone"" rel=""nofollow"">Twitter for iPhone</a>","nona14gable",0,FALSE,FALSE,NA,NA
"202","11 because neymar,klose,oscar and robben jersey number",FALSE,0,NA,2014-07-15 11:27:37,FALSE,NA,"489008379566624768",NA,"<a href=""http://twitter.com/download/android"" rel=""nofollow"">Twitter for Android</a>","lavernekoon",0,FALSE,FALSE,NA,NA
"203","""@tamayomanuel7: We should all pitch in to get Jomi a Klose jersey for his bday lol"" http://t.co/nT7O6qQKf1",FALSE,3,NA,2014-07-15 03:55:27,FALSE,NA,"488894585867759616",NA,"<a href=""http://twitter.com/download/android"" rel=""nofollow"">Twitter for Android</a>","jadeniran_says",0,FALSE,FALSE,NA,NA
"204","RT @tamayomanuel7: We should all pitch in to get Jomi a Klose jersey for his bday lol",FALSE,0,NA,2014-07-15 03:54:28,FALSE,NA,"488894339733401600",NA,"<a href=""http://twitter.com/download/android"" rel=""nofollow"">Twitter for Android</a>","jadeniran_says",1,TRUE,FALSE,NA,NA
"205","We should all pitch in to get Jomi a Klose jersey for his bday lol",FALSE,3,NA,2014-07-15 03:53:48,FALSE,NA,"488894170845573120",NA,"<a href=""http://twitter.com/download/android"" rel=""nofollow"">Twitter for Android</a>","tamayomanuel7",1,FALSE,FALSE,NA,NA
"206","Waiting for the 4 stars jersey #Germany #WorldCup #WorldCupFinal #klose",FALSE,0,NA,2014-07-15 03:11:58,FALSE,NA,"488883646427070464",NA,"<a href=""http://twitter.com/download/iphone"" rel=""nofollow"">Twitter for iPhone</a>","mesop0tamian",0,FALSE,FALSE,NA,NA
"207","@kimravioli yesyes!! :']]] she bought a fake klose jersey haha XD",FALSE,0,"kimravioli",2014-07-15 02:55:14,FALSE,"488715532997107714","488879432547827712","1661662273","<a href=""http://twitter.com"" rel=""nofollow"">Twitter Web Client</a>","yunchikan",0,FALSE,FALSE,NA,NA
"208","SOOOOOOO gonna buy a four stars klose jersey, i love you miro!",FALSE,0,NA,2014-07-15 02:52:01,FALSE,NA,"488878623143645185",NA,"<a href=""http://twitter.com/download/android"" rel=""nofollow"">Twitter for Android</a>","notastrid",0,FALSE,FALSE,NA,NA
"209","Now that I think about it, I need a #Klose jersey #GER",FALSE,0,NA,2014-07-15 02:18:12,FALSE,NA,"488870113123106817",NA,"<a href=""http://twitter.com"" rel=""nofollow"">Twitter Web Client</a>","Efraaawr",0,FALSE,FALSE,NA,NA
"210","THE CHEAPEST MIROSLAV KLOSE JERSEY IS LIKE 60 DOLLARS WTF",FALSE,1,NA,2014-07-15 02:10:43,FALSE,NA,"488868228538458112",NA,"<a href=""http://twitter.com/download/android"" rel=""nofollow"">Twitter for Android</a>","jadeniran_says",0,FALSE,FALSE,NA,NA
"211","Fuck ya I found the official @DFB_Team_EN website. Now I can get my Klose Jersey",FALSE,0,NA,2014-07-15 01:34:06,FALSE,NA,"488859014873100289",NA,"<a href=""http://twitter.com/download/android"" rel=""nofollow"">Twitter for Android</a>","mstwofour",0,FALSE,FALSE,"-118.4321517","34.1997147"
"212","I want a Klose Germany jersey so bad, someone buy it for me pls",FALSE,0,NA,2014-07-15 00:54:26,FALSE,NA,"488849032748752896",NA,"<a href=""http://twitter.com/download/android"" rel=""nofollow"">Twitter for Android</a>","akhan_RM",0,FALSE,FALSE,NA,NA
"213","bc i wanna get a schweinsteiger jersey but also a m√ºller one and a klose one.....and i wanna see if there's a neuer one......",FALSE,2,NA,2014-07-15 00:41:35,FALSE,NA,"488845798319214592",NA,"<a href=""http://twitter.com"" rel=""nofollow"">Twitter Web Client</a>","ljkaram",0,FALSE,FALSE,NA,NA
"214","@realpatmoran boss up! Haha my klose jersey is on it's wayÌ†ΩÌ±å",FALSE,0,"realpatmoran",2014-07-18 18:51:27,FALSE,"490207020596072448","490207238586245121","797578454","<a href=""http://twitter.com/download/iphone"" rel=""nofollow"">Twitter for iPhone</a>","TheOaksmobile",0,FALSE,FALSE,NA,NA
"215","When the #legend #klose wore the away jersey during the semi-finals match against Brazil, and topped‚Ä¶ http://t.co/sbto5qjxXm",FALSE,0,NA,2014-07-18 16:31:28,FALSE,NA,"490172008907673600",NA,"<a href=""http://instagram.com"" rel=""nofollow"">Instagram</a>","jessicasyy",0,FALSE,FALSE,NA,NA
"216","Onkel Klose, i want your jersey , can I ?",FALSE,0,NA,2014-07-18 12:44:08,FALSE,NA,"490114797468262400",NA,"<a href=""http://twitter.com"" rel=""nofollow"">Twitter Web Client</a>","cykinaa",0,FALSE,FALSE,NA,NA
"217","Collected my ""Klose 11"" #germany away jersey finally!! The legend wore this and scored his 16th goal,‚Ä¶ http://t.co/B4he2rcfZe",FALSE,0,NA,2014-07-18 12:15:20,FALSE,NA,"490107550428172288",NA,"<a href=""http://instagram.com"" rel=""nofollow"">Instagram</a>","jessicasyy",0,FALSE,FALSE,NA,NA
"218","@CesarThePanda now why would i do that? Is#15 goetze Or is klose nope &amp; since i called him making the winning goal his jersey is what i want",FALSE,0,"CesarThePanda",2014-07-18 07:53:11,FALSE,NA,"490041577113665536","417483927","<a href=""http://www.cloudhopper.com/"" rel=""nofollow"">Cloudhopper</a>","Simply_Diego",0,FALSE,FALSE,NA,NA
"219","Ready for my Klose jersey to come in.",FALSE,0,NA,2014-07-18 00:54:47,FALSE,NA,"489936284995948544",NA,"<a href=""http://twitter.com"" rel=""nofollow"">Twitter Web Client</a>","appsTATE12",0,FALSE,FALSE,NA,NA
"220","I want a #WorldCup2014 worn jersey from Klose and @Jermainejunior @FIFAWorldCup #WishList",FALSE,0,NA,2014-07-17 21:31:42,FALSE,NA,"489885175447166976",NA,"<a href=""http://twitter.com/download/iphone"" rel=""nofollow"">Twitter for iPhone</a>","chcobra95",0,FALSE,FALSE,NA,NA
"221","RT @ImDanzzy: @jamesgolightly2 Should I get Muller or Klose on the back of the Germany jersey? Im about to get an official jersey (player v‚Ä¶",FALSE,0,NA,2014-07-17 19:46:44,FALSE,NA,"489858763118366721",NA,"<a href=""http://twitter.com/download/iphone"" rel=""nofollow"">Twitter for iPhone</a>","jamesgolightly2",1,TRUE,FALSE,NA,NA
"222","@jamesgolightly2 Should I get Muller or Klose on the back of the Germany jersey? Im about to get an official jersey (player version)",FALSE,0,"jamesgolightly2",2014-07-17 19:46:10,FALSE,NA,"489858619320438784","1733061619","<a href=""https://about.twitter.com/products/tweetdeck"" rel=""nofollow"">TweetDeck</a>","ImDanzzy",1,FALSE,FALSE,NA,NA
"223","Tough deciding between getting a Klose or a M√ºller jersey. Decided for Mito, the clever fucker has a long way ahead of him.",FALSE,1,NA,2014-07-17 01:54:46,FALSE,NA,"489588992577658880",NA,"<a href=""http://twitter.com"" rel=""nofollow"">Twitter Web Client</a>","totalkicker",0,FALSE,FALSE,NA,NA
